[
   {
      "username":"jeromevyabut",
      "fullname":"Jerome Yabut",
      "birthday":"1994-01-06",
      "gender":"male",
      "dateRegistered":"2021-01-01"
   },
   {
      "username":"jeromevyabut2",
      "fullname":"Jerome Yabut",
      "birthday":"1994-01-06",
      "gender":"male",
      "dateRegistered":"2021-01-01"
   }
]